{"audit_policy_path":"assurance/audit/sow/audit-policy.toml","audit_policy_sha256":"eda28392c5e52b6242a7b796562afeb5c4af342ae17a31f1115b83e3463b4a99","audit_scope_path":"assurance/audit/sow/audit-scope.toml","audit_scope_sha256":"066f83e994f0a3fa15b6c8180048290b65d68a856f3cd8cfac476db0efef2a58","freeze_id":"dcrypt-v3.0.0-audit-candidate-003","freeze_json_sha256":"fbf38be9f0bfa11fb077968685ce2d9279411d110a9f4b0b43ebd012803bd49a","schema_version":1,"sow_path":"assurance/audit/sow/RFP-SOW.md","sow_sha256":"e7332306b6f956a1684c3f2ec7eebbc8c32f50cc7877131bdefb1d57b38bc868","status":"candidate-first-party-unreplayed","subject_commit":"68b3bf5ba2121ef3dcec131406441e4cb6055855","subject_tree":"f282a55aa0f6d0985d461e896d56e65f01becb56"}
